row_id,question_heard,underlying_intent,suggested_action,owner,due_date,status,source_ref
Q1,"It also depends upon if some similar design already exists within the code base.This or not, how clearly?",Leadership clarification or follow-up required,Capture follow-up response and assign owner for closure.,,,Open,line_20
Q2,"So let me say for then the SAS solution available in the marketing, what is the workflow?",End-to-end workflow differentiation,Map the full workflow and distinguish it from standalone tools.,,,Open,line_38
Q3,"As of now ADO integration is there, reports are there.Test data management is there but if you want to use a particular tool then there are some customization which are needed and for that one month two people that is what it needed",Quality assurance completeness,"Explain recommended test coverage, validation flow, and traceability.",,,Open,line_108
Q4,:23OK.Can you can you select the minute test cases?,Quality assurance completeness,"Explain recommended test coverage, validation flow, and traceability.",,,Open,line_133
Q5,":52Yeah, so you you can implement like those test cases pretty good and once those test cases are executed, you get a report.What?",Quality assurance completeness,"Explain recommended test coverage, validation flow, and traceability.",,,Open,line_150
Q6,I'll just cover the two main important question like why now and what is the solution?,Leadership clarification or follow-up required,Capture follow-up response and assign owner for closure.,,,Open,line_226
Q7,":13In both.OK, so this is the GEO agent. So the process begins with the user query and AI agents analyze the customer website content and simulate how AI system would respond to the responses are benchmarked against the competition.And multiple optimization techniques are applied. Finally, this system generates GEO inside optimization artifacts and improvement report. So I'll just quickly show what are the artifacts.OK, so like in this GU optimization framework you see that this is the query that that I have provided and this is a user provided question. So the like the question that I have entered here is which trusted soft.Software solution provider can help to streamline or enterprise operations. You can see this screen, the demo screen. Please if you can confirm. Hello.",Scope clarity and roadmap alignment,Capture follow-up response and assign owner for closure.,,,Open,line_232
